{
  "schema_version": "launch-gate-manifest-v0",
  "status": "draft_all_closed",
  "generated_for": {
    "environment": "local",
    "release_ref": "local-draft",
    "generated_at": "2026-05-16T00:00:00Z"
  },
  "gates": [
    {
      "gate_id": "PR-001",
      "owner_role": "role:product_owner",
      "status": "closed",
      "authority": {
        "document_path": "backlog/production-readiness.md",
        "accepted_revision": null
      },
      "public_safe_status_label": "closed_no_evidence",
      "private_threshold_ref": "private-threshold:wedge-001.acceptance",
      "required_fixture_refs": ["fixtures/wedge-evidence.sample.json"],
      "ci_result_refs": ["ci:gates-all.local"],
      "evidence_refs": [],
      "rollback_target": "keep-m1-ingestion-disabled",
      "stale_review_behavior": "keep_disabled",
      "blocking_dependents": ["M1", "non_synthetic_body_persistence_gate"],
      "review_expires_at": null
    },
    {
      "gate_id": "PR-002",
      "owner_role": "role:database_on_call",
      "status": "closed",
      "authority": {
        "document_path": "backlog/production-readiness.md",
        "accepted_revision": null
      },
      "public_safe_status_label": "closed_no_evidence",
      "private_threshold_ref": "private-threshold:protected-data-durability",
      "required_fixture_refs": ["fixtures/runbook-command-manifest.draft.json"],
      "ci_result_refs": ["ci:runbook-manifest.local"],
      "evidence_refs": [],
      "rollback_target": "keep-non-synthetic-storage-disabled",
      "stale_review_behavior": "quarantine",
      "blocking_dependents": ["M1", "M2", "M3", "non_synthetic_body_persistence_gate"],
      "review_expires_at": null
    },
    {
      "gate_id": "PR-003",
      "owner_role": "role:security_privacy_owner",
      "status": "closed",
      "authority": {
        "document_path": "backlog/production-readiness.md",
        "accepted_revision": null
      },
      "public_safe_status_label": "closed_no_evidence",
      "private_threshold_ref": "private-threshold:consent-revocation-ux",
      "required_fixture_refs": [
        "fixtures/consent-revocation-gate.draft.json",
        "fixtures/private-use-notice.local-draft.json",
        "schemas/consent-revocation-gate.schema.json",
        "tests/test_consent_revocation_gate.py"
      ],
      "ci_result_refs": ["ci:private-use-notice.local", "ci:consent-gates.local"],
      "evidence_refs": [],
      "rollback_target": "keep-consent-completion-disabled",
      "stale_review_behavior": "keep_disabled",
      "blocking_dependents": ["M1", "M2", "team-alpha", "public-pilot"],
      "review_expires_at": null
    },
    {
      "gate_id": "PR-004",
      "owner_role": "role:platform_security_owner",
      "status": "closed",
      "authority": {
        "document_path": "backlog/production-readiness.md",
        "accepted_revision": null
      },
      "public_safe_status_label": "closed_no_evidence",
      "private_threshold_ref": "private-threshold:non-local-auth-verifier",
      "required_fixture_refs": [
        "fixtures/auth-verifier-gate.draft.json",
        "schemas/auth-verifier-gate.schema.json",
        "tests/test_auth_verifier_gate.py",
        "tests/test_m0_contract_split.py"
      ],
      "ci_result_refs": ["ci:m0-contract-split.local", "ci:auth-gates.local"],
      "evidence_refs": [],
      "rollback_target": "keep-local-hs256-local-only",
      "stale_review_behavior": "fail_closed",
      "blocking_dependents": ["M1", "M2", "M3", "M5", "production"],
      "review_expires_at": null
    },
    {
      "gate_id": "PR-005",
      "owner_role": "role:reviewer_operator",
      "status": "closed",
      "authority": {
        "document_path": "backlog/production-readiness.md",
        "accepted_revision": null
      },
      "public_safe_status_label": "closed_no_evidence",
      "private_threshold_ref": "private-threshold:public-search-publication",
      "required_fixture_refs": ["fixtures/review-ops-gates.draft.json", "fixtures/m3-retrieval-gates.draft.json"],
      "ci_result_refs": ["ci:review-gates.local", "ci:m3-gates.local"],
      "evidence_refs": [],
      "rollback_target": "keep-public-search-publication-disabled",
      "stale_review_behavior": "withdraw_public_route",
      "blocking_dependents": ["M6", "public-pilot"],
      "review_expires_at": null
    },
    {
      "gate_id": "PR-005A",
      "owner_role": "role:landing_operator",
      "status": "closed",
      "authority": {
        "document_path": "backlog/production-readiness.md",
        "accepted_revision": null
      },
      "public_safe_status_label": "closed_draft_scaffold_only",
      "private_threshold_ref": "private-threshold:public-document-release",
      "required_fixture_refs": ["fixtures/runbook-command-manifest.draft.json"],
      "ci_result_refs": ["ci:check-lp.local"],
      "evidence_refs": [],
      "rollback_target": "keep-public-doc-routes-pending",
      "stale_review_behavior": "withdraw_public_route",
      "blocking_dependents": ["public-docs", "public-pilot"],
      "review_expires_at": null
    },
    {
      "gate_id": "PR-006",
      "owner_role": "role:security_privacy_owner",
      "status": "closed",
      "authority": {
        "document_path": "backlog/production-readiness.md",
        "accepted_revision": null
      },
      "public_safe_status_label": "closed_no_evidence",
      "private_threshold_ref": "private-threshold:core-intake-safety",
      "required_fixture_refs": [
        "fixtures/intake-safety-gate.draft.json",
        "schemas/card-payload-v1.schema.json",
        "schemas/intake-safety-gate.schema.json",
        "tests/test_card_payload_schema.py",
        "tests/test_intake_safety_gate.py"
      ],
      "ci_result_refs": ["ci:card-payload-schema.local", "ci:intake-gates.local"],
      "evidence_refs": [],
      "rollback_target": "keep-submit-candidate-synthetic-only",
      "stale_review_behavior": "fail_closed",
      "blocking_dependents": ["M1", "M2", "M5", "non_synthetic_body_persistence_gate"],
      "review_expires_at": null
    },
    {
      "gate_id": "PR-007",
      "owner_role": "role:enterprise_owner",
      "status": "closed",
      "authority": {
        "document_path": "backlog/production-readiness.md",
        "accepted_revision": null
      },
      "public_safe_status_label": "closed_no_evidence",
      "private_threshold_ref": "private-threshold:enterprise-governance",
      "required_fixture_refs": [],
      "ci_result_refs": [],
      "evidence_refs": [],
      "rollback_target": "keep-managed-guidance-disabled",
      "stale_review_behavior": "keep_disabled",
      "blocking_dependents": ["enterprise-alpha"],
      "review_expires_at": null
    },
    {
      "gate_id": "non_synthetic_body_persistence_gate",
      "owner_role": "role:security_privacy_owner",
      "status": "closed",
      "authority": {
        "document_path": "backlog/production-readiness.md",
        "accepted_revision": null
      },
      "public_safe_status_label": "closed_no_evidence",
      "private_threshold_ref": "private-threshold:non-synthetic-body-persistence",
      "required_fixture_refs": [
        "fixtures/intake-safety-gate.draft.json",
        "fixtures/launch-gate-manifest.draft.json",
        "fixtures/private-use-notice.local-draft.json",
        "fixtures/wedge-evidence.sample.json"
      ],
      "ci_result_refs": ["ci:gates-all.local"],
      "evidence_refs": [],
      "rollback_target": "keep-non-synthetic-body-storage-disabled",
      "stale_review_behavior": "fail_closed",
      "blocking_dependents": ["M1", "M2", "team-alpha", "public-pilot"],
      "review_expires_at": null
    }
  ]
}
